{
  "schema": 3,
  "repo": "sample/mobile-app",
  "issue": 18,
  "title": "Saved items disappear after refresh",
  "url": "https://github.com/sample/mobile-app/issues/18",
  "state": "FLAKY",
  "provider": "stub",
  "stubbed": true,
  "created_at": "2026-09-26T09:00:00Z",
  "updated_at": "2026-09-26T10:42:00Z",
  "replication": {
    "verdict": "FLAKY",
    "duration_ms": 360000,
    "question": "",
    "repro": {
      "sequence": "PPFPPPPFPPPPFPPPPPPP",
      "trials": 20,
      "failed": 3,
      "invalid": 0,
      "rate": 0.15,
      "run_context": {
        "platform": "ios",
        "executor": "ci",
        "method": "repo_command",
        "host_os": "ios",
        "device": "iPhone simulator",
        "ci_run_url": null,
        "runner_version": "sample"
      }
    },
    "diagnosis": {
      "summary": "Sample diagnosis: an asynchronous update uses state from before the latest interaction.",
      "locations": [],
      "fix_direction": "Check the current state before applying the update.",
      "confidence": "medium"
    }
  },
  "fix": {
    "iterations": []
  },
  "events": [
    {
      "at": "2026-09-26T09:00:00Z",
      "type": "acknowledged",
      "detail": "Sample report acknowledged."
    },
    {
      "at": "2026-09-26T10:42:00Z",
      "type": "verdict",
      "detail": "Sample results recorded."
    }
  ]
}
