{
  "schema": 3,
  "repo": "sample/desktop-app",
  "issue": 7,
  "title": "Export closes the application",
  "url": "https://github.com/sample/desktop-app/issues/7",
  "state": "CONFIRMED",
  "provider": "stub",
  "stubbed": true,
  "created_at": "2026-09-26T09:00:00Z",
  "updated_at": "2026-09-26T10:53:00Z",
  "replication": {
    "verdict": "CONFIRMED",
    "duration_ms": 180000,
    "question": "",
    "repro": {
      "sequence": "FFFFFFFFFF",
      "trials": 10,
      "failed": 10,
      "invalid": 0,
      "rate": 1,
      "run_context": {
        "platform": "windows",
        "executor": "local",
        "method": "repo_command",
        "host_os": "windows",
        "device": "Windows desktop",
        "ci_run_url": null,
        "runner_version": "sample"
      }
    },
    "diagnosis": {
      "summary": "Sample diagnosis: an asynchronous update uses state from before the latest interaction.",
      "locations": [],
      "fix_direction": "Check the current state before applying the update.",
      "confidence": "medium"
    }
  },
  "fix": {
    "iterations": []
  },
  "events": [
    {
      "at": "2026-09-26T09:00:00Z",
      "type": "acknowledged",
      "detail": "Sample report acknowledged."
    },
    {
      "at": "2026-09-26T10:53:00Z",
      "type": "verdict",
      "detail": "Sample results recorded."
    }
  ]
}
