{
  "schema": 3,
  "repo": "reprise-demo/pocket-ledger",
  "issue": 5,
  "title": "Window position resets after sleep",
  "url": "https://github.com/reprise-demo/pocket-ledger/issues/5",
  "state": "NEEDS_INFO",
  "provider": "bob",
  "stubbed": false,
  "created_at": "2026-09-26T13:20:00.000Z",
  "updated_at": "2026-09-26T13:23:00.000Z",
  "replication": {
    "verdict": "NEEDS_INFO",
    "acknowledged_by": "maintainer",
    "started_at": "2026-09-26T13:20:00.000Z",
    "finished_at": "2026-09-26T13:23:00.000Z",
    "duration_ms": 180000,
    "fingerprint": {
      "platform": "linux",
      "component": "window",
      "functions": [],
      "symptom": "Window moves to the primary monitor",
      "trigger": "",
      "expected": "",
      "actual": "",
      "error_signature": ""
    },
    "duplicate": {
      "of": null,
      "score": null,
      "fields": {},
      "reason": "",
      "behaviour_check": null
    },
    "question": "Which desktop environment and monitor layout were you using when the window moved?",
    "repro": {
      "test_origin": "provided",
      "test_file": "",
      "test_sha256": "",
      "branch": "reprise/repro-5",
      "signature": {
        "kind": "assertion_message",
        "pattern": ""
      },
      "attempts": 0,
      "run_context": {
        "platform": "linux",
        "executor": "local",
        "method": "repo_command",
        "host_os": "linux",
        "device": "",
        "ci_run_url": null,
        "runner_version": "0.1.0"
      },
      "trials": 0,
      "failed": 0,
      "invalid": 0,
      "sequence": "",
      "trials_policy": {
        "min": 10,
        "max": 20,
        "limit": 100,
        "max_minutes": null,
        "source": "config",
        "stopped_by": "all_failed_at_min"
      },
      "rate": 0,
      "wilson_low": 0,
      "wilson_high": 0
    },
    "diagnosis": {
      "summary": "",
      "locations": [],
      "fix_direction": "",
      "confidence": "medium",
      "accepted_by": "",
      "edited": false
    }
  },
  "fix": {
    "iterations": []
  },
  "resolution_note": "",
  "usage": {
    "provider": "bob",
    "calls": 4,
    "by_stage": {
      "intake": 1,
      "dedupe": 1,
      "test": 1,
      "rootcause": 0,
      "fix": 0
    }
  },
  "events": [
    {
      "at": "2026-09-26T13:20:00.000Z",
      "type": "acknowledged",
      "detail": ""
    },
    {
      "at": "2026-09-26T13:21:00.000Z",
      "type": "intake.done",
      "detail": ""
    },
    {
      "at": "2026-09-26T13:23:00.000Z",
      "type": "verdict",
      "detail": "NEEDS_INFO"
    }
  ]
}
