{
  "schema": 3,
  "repo": "sample/desktop-app",
  "issue": 9,
  "title": "Search drops the first character",
  "url": "https://github.com/sample/desktop-app/issues/9",
  "state": "NEEDS_INFO",
  "provider": "stub",
  "stubbed": true,
  "created_at": "2026-09-26T09:00:00Z",
  "updated_at": "2026-09-26T10:51:00Z",
  "replication": {
    "verdict": "NEEDS_INFO",
    "duration_ms": 120000,
    "question": "Which keyboard layout triggers the missing character?",
    "repro": {
      "sequence": "",
      "trials": 0,
      "failed": 0,
      "invalid": 0,
      "rate": 0,
      "run_context": {
        "platform": "linux",
        "executor": "local",
        "method": "repo_command",
        "host_os": "linux",
        "device": "Linux desktop",
        "ci_run_url": null,
        "runner_version": "sample"
      }
    },
    "diagnosis": {
      "summary": "More information is needed before reproducing this report.",
      "locations": [],
      "fix_direction": "Check the current state before applying the update.",
      "confidence": "medium"
    }
  },
  "fix": {
    "iterations": []
  },
  "events": [
    {
      "at": "2026-09-26T09:00:00Z",
      "type": "acknowledged",
      "detail": "Sample report acknowledged."
    },
    {
      "at": "2026-09-26T10:51:00Z",
      "type": "verdict",
      "detail": "Sample results recorded."
    }
  ]
}
