{
  "schema": 3,
  "repo": "reprise-demo/pocket-ledger",
  "issue": 6,
  "title": "Menu bar extra shows two icons after relaunch",
  "url": "https://github.com/reprise-demo/pocket-ledger/issues/6",
  "state": "CONFIRMED",
  "provider": "bob",
  "stubbed": false,
  "created_at": "2026-09-26T14:20:00.000Z",
  "updated_at": "2026-09-26T14:26:00.000Z",
  "replication": {
    "verdict": "CONFIRMED",
    "acknowledged_by": "maintainer",
    "started_at": "2026-09-26T14:20:00.000Z",
    "finished_at": "2026-09-26T14:26:00.000Z",
    "duration_ms": 360000,
    "fingerprint": {
      "platform": "macos",
      "component": "menubar",
      "functions": [],
      "symptom": "Two status items appear",
      "trigger": "",
      "expected": "",
      "actual": "",
      "error_signature": ""
    },
    "duplicate": {
      "of": null,
      "score": null,
      "fields": {},
      "reason": "",
      "behaviour_check": null
    },
    "question": "",
    "repro": {
      "test_origin": "provided",
      "test_file": "PocketLedgerUITests/MenuBarTests.swift",
      "test_sha256": "a3f1a3f1a3f1a3f1a3f1a3f1a3f1a3f1a3f1a3f1a3f1a3f1a3f1a3f1a3f1a3f1",
      "branch": "reprise/repro-6",
      "signature": {
        "kind": "assertion_message",
        "pattern": "REPRISE-6 duplicate status item"
      },
      "attempts": 1,
      "run_context": {
        "platform": "macos",
        "executor": "ci",
        "method": "repo_command",
        "host_os": "darwin",
        "device": "macos-15 runner",
        "ci_run_url": "https://github.com/reprise-demo/pocket-ledger/actions/runs/1",
        "runner_version": null
      },
      "trials": 10,
      "failed": 10,
      "invalid": 0,
      "sequence": "FFFFFFFFFF",
      "trials_policy": {
        "min": 10,
        "max": 20,
        "limit": 100,
        "max_minutes": null,
        "source": "config",
        "stopped_by": "all_failed_at_min"
      },
      "rate": 1,
      "wilson_low": 0.7224672001371107,
      "wilson_high": 0.9999999999999999
    },
    "diagnosis": {
      "summary": "The status item is created in both applicationDidFinishLaunching and the restoration handler.",
      "locations": [
        {
          "file": "PocketLedger/AppDelegate.swift",
          "start_line": 22,
          "end_line": 35,
          "reason": "second NSStatusItem created on restore"
        }
      ],
      "fix_direction": "Create the status item once and reuse it on restoration.",
      "confidence": "high",
      "accepted_by": "",
      "edited": false
    }
  },
  "fix": {
    "iterations": []
  },
  "resolution_note": "",
  "usage": {
    "provider": "bob",
    "calls": 4,
    "by_stage": {
      "intake": 1,
      "dedupe": 1,
      "test": 1,
      "rootcause": 1,
      "fix": 0
    }
  },
  "events": [
    {
      "at": "2026-09-26T14:20:00.000Z",
      "type": "acknowledged",
      "detail": ""
    },
    {
      "at": "2026-09-26T14:21:00.000Z",
      "type": "intake.done",
      "detail": ""
    },
    {
      "at": "2026-09-26T14:22:00.000Z",
      "type": "test.approved",
      "detail": "PocketLedgerUITests/MenuBarTests.swift"
    },
    {
      "at": "2026-09-26T14:26:00.000Z",
      "type": "verdict",
      "detail": "CONFIRMED"
    }
  ]
}
