{
  "schema": 3,
  "repo": "sample/mobile-app",
  "issue": 12,
  "title": "Checkout stalls after reconnecting",
  "url": "https://github.com/sample/mobile-app/issues/12",
  "state": "FIX_VERIFIED",
  "provider": "stub",
  "stubbed": true,
  "created_at": "2026-09-26T09:00:00Z",
  "updated_at": "2026-09-26T10:48:00Z",
  "replication": {
    "verdict": "FLAKY",
    "duration_ms": 420000,
    "question": "",
    "repro": {
      "sequence": "FPPFPPPPFPPPPPFPPPPP",
      "trials": 20,
      "failed": 4,
      "invalid": 0,
      "rate": 0.2,
      "run_context": {
        "platform": "android",
        "executor": "local",
        "method": "repo_command",
        "host_os": "android",
        "device": "Android emulator",
        "ci_run_url": null,
        "runner_version": "sample"
      }
    },
    "diagnosis": {
      "summary": "Sample diagnosis: an asynchronous update uses state from before the latest interaction.",
      "locations": [],
      "fix_direction": "Check the current state before applying the update.",
      "confidence": "medium"
    }
  },
  "fix": {
    "iterations": [
      {
        "n": 1,
        "source": "provider",
        "pr": null,
        "summary": "Sample fix: discard stale updates.",
        "verification": {
          "verdict": "FIX_VERIFIED",
          "run_context": {
            "platform": "android",
            "executor": "local",
            "method": "repo_command",
            "host_os": "android",
            "device": "Android emulator",
            "ci_run_url": null,
            "runner_version": "sample"
          },
          "repro": {
            "runs_required": 36,
            "runs": 36,
            "failed": 0,
            "invalid": 0,
            "evidence": "strong",
            "claim": "The reported bug did not reproduce in 36 verification runs."
          },
          "regression": {
            "tests_total": 24,
            "counts": {
              "UNCHANGED_PASS": 24
            },
            "blocking": [],
            "notable": []
          }
        }
      }
    ]
  },
  "events": [
    {
      "at": "2026-09-26T09:00:00Z",
      "type": "acknowledged",
      "detail": "Sample report acknowledged."
    },
    {
      "at": "2026-09-26T10:48:00Z",
      "type": "verdict",
      "detail": "Sample results recorded."
    }
  ]
}
